### ISSUE TITLE
Issue constructing  

### ISSUE THREAD

**Issue by LYN3S-CO-UK** [vforteli/Flexinets.Ldap.Server#2]
This is a really useful tool. 

I am having issues constructing a response. The search request is for ObjectClass=* with attributes: 
msDS-PortSSL
msDS-PortLDAP
domainControllerFunctionality
dnsHostName
supportedCapabilities

A successful response list the attributes as PartialAttributeLists. I've tried a few methods but all have failed. Are you able to provide an example response?

**Comment by vforteli** [comment]
Tbh I havent really used this for other than mainly basic operations like bind and search requests and responses. I guess it should be possible to generate a proper response with this library though.
Do you happen to have a network capture dump of the ldap request and response?

**Comment by vforteli** [comment]
I havent tried this, but something like this may work as a response. Of course the attributes would need to be changed to whatever is needed.

```
var responseEntryPacket = new LdapPacket(requestPacket.MessageId);
var searchResultEntry = new LdapAttribute(LdapOperation.SearchResultEntry);
searchResultEntry.ChildAttributes.Add(new LdapAttribute(UniversalDataType.OctetString, "cn=testuser,cn=Users,dc=dev,dc=company,dc=com"));   //  objectName

var partialAttributeList = new LdapAttribute(UniversalDataType.Sequence);
// Partial attribute list with two attributes

// uid attribute
var partialAttributeUid = new LdapAttribute(UniversalDataType.Sequence);
partialAttributeUid.ChildAttributes.Add(new LdapAttribute(UniversalDataType.OctetString, "uid"));   // type
var partialAttributeUidValues = new LdapAttribute(UniversalDataType.Set);
partialAttributeUidValues.ChildAttributes.Add(new LdapAttribute(UniversalDataType.OctetString, "useruidgoeshere"));
partialAttributeUid.ChildAttributes.Add(partialAttributeUidValues);
partialAttributeList.ChildAttributes.Add(partialAttributeUid);

// objectClass attribute with three values
var partialAttributeObjectClass = new LdapAttribute(UniversalDataType.Sequence);
partialAttributeObjectClass.ChildAttributes.Add(new LdapAttribute(UniversalDataType.OctetString, "objectClass"));   // type
var partialAttributeObjectClassValues = new LdapAttribute(UniversalDataType.Set);
partialAttributeObjectClassValues.ChildAttributes.Add(new LdapAttribute(UniversalDataType.OctetString, "posixAccount"));
partialAttributeObjectClassValues.ChildAttributes.Add(new LdapAttribute(UniversalDataType.OctetString, "shadowAccount"));
partialAttributeObjectClassValues.ChildAttributes.Add(new LdapAttribute(UniversalDataType.OctetString, "inetOrgPerson"));
partialAttributeObjectClass.ChildAttributes.Add(partialAttributeObjectClassValues);
partialAttributeList.ChildAttributes.Add(partialAttributeObjectClass);

searchResultEntry.ChildAttributes.Add(partialAttributeList);
responseEntryPacket.ChildAttributes.Add(searchResultEntry);
```

It quickly becomes quite verbose, so I suppose some helper methods for creating sequences and sets wouldnt hurt...

**Comment by JDL-84** [comment]
No.     Time                          Source                Destination           Length Protocol Info                                                            New Column
      7 2018-06-11 15:29:46.027021400 10.202.36.35          172.16.22.27          66     TCP      49984 → 389 [SYN, ECN, CWR] Seq=0 Win=8192 Len=0 MSS=1460 WS=256 SACK_PERM=1 389

Frame 7: 66 bytes on wire (528 bits), 66 bytes captured (528 bits)
Ethernet II, Src: Cisco_16:c7:43 (44:d3:ca:16:c7:43), Dst: Vmware_ca:ca:9d (00:0c:29:ca:ca:9d)
Internet Protocol Version 4, Src: 10.202.36.35, Dst: 172.16.22.27
Transmission Control Protocol, Src Port: 49984, Dst Port: 389, Seq: 0, Len: 0

No.     Time                          Source                Destination           Length Protocol Info                                                            New Column
      8 2018-06-11 15:29:46.027126100 172.16.22.27          10.202.36.35          66     TCP      389 → 49984 [SYN, ACK, ECN] Seq=0 Ack=1 Win=8192 Len=0 MSS=1460 WS=256 SACK_PERM=1 49984

Frame 8: 66 bytes on wire (528 bits), 66 bytes captured (528 bits)
Ethernet II, Src: Vmware_ca:ca:9d (00:0c:29:ca:ca:9d), Dst: Cisco_16:c7:43 (44:d3:ca:16:c7:43)
Internet Protocol Version 4, Src: 172.16.22.27, Dst: 10.202.36.35
Transmission Control Protocol, Src Port: 389, Dst Port: 49984, Seq: 0, Ack: 1, Len: 0

No.     Time                          Source                Destination           Length Protocol Info                                                            New Column
      9 2018-06-11 15:29:46.040451200 10.202.36.35          172.16.22.27          60     TCP      49984 → 389 [ACK] Seq=1 Ack=1 Win=131328 Len=0                389

Frame 9: 60 bytes on wire (480 bits), 60 bytes captured (480 bits)
Ethernet II, Src: Cisco_16:c7:43 (44:d3:ca:16:c7:43), Dst: Vmware_ca:ca:9d (00:0c:29:ca:ca:9d)
Internet Protocol Version 4, Src: 10.202.36.35, Dst: 172.16.22.27
Transmission Control Protocol, Src Port: 49984, Dst Port: 389, Seq: 1, Ack: 1, Len: 0

No.     Time                          Source                Destination           Length Protocol Info                                                            New Column
     10 2018-06-11 15:29:46.040539000 10.202.36.35          172.16.22.27          201    LDAP     searchRequest(78) "<ROOT>" baseObject                           389

Frame 10: 201 bytes on wire (1608 bits), 201 bytes captured (1608 bits)
Ethernet II, Src: Cisco_16:c7:43 (44:d3:ca:16:c7:43), Dst: Vmware_ca:ca:9d (00:0c:29:ca:ca:9d)
Internet Protocol Version 4, Src: 10.202.36.35, Dst: 172.16.22.27
Transmission Control Protocol, Src Port: 49984, Dst Port: 389, Seq: 1, Ack: 1, Len: 147
Lightweight Directory Access Protocol
    LDAPMessage searchRequest(78) "<ROOT>" baseObject
        messageID: 78
        protocolOp: searchRequest (3)
            searchRequest
                baseObject: 
                scope: baseObject (0)
                derefAliases: neverDerefAliases (0)
                sizeLimit: 0
                timeLimit: 0
                typesOnly: False
                Filter: (objectClass=*)
                    filter: present (7)
                        present: objectClass
                attributes: 5 items
                    AttributeDescription: msDS-PortSSL
                    AttributeDescription: msDS-PortLDAP
                    AttributeDescription: domainControllerFunctionality
                    AttributeDescription: dnsHostName
                    AttributeDescription: supportedCapabilities
        [Response In: 11]

No.     Time                          Source                Destination           Length Protocol Info                                                            New Column
     11 2018-06-11 15:29:46.040798900 172.16.22.27          10.202.36.35          443    LDAP     searchResEntry(78) "<ROOT>"  | searchResDone(78) success  [1 result] 49984

Frame 11: 443 bytes on wire (3544 bits), 443 bytes captured (3544 bits)
Ethernet II, Src: Vmware_ca:ca:9d (00:0c:29:ca:ca:9d), Dst: Cisco_16:c7:43 (44:d3:ca:16:c7:43)
Internet Protocol Version 4, Src: 172.16.22.27, Dst: 10.202.36.35
Transmission Control Protocol, Src Port: 389, Dst Port: 49984, Seq: 1, Ack: 148, Len: 389
Lightweight Directory Access Protocol
    LDAPMessage searchResEntry(78) "<ROOT>" [1 result]
        messageID: 78
        protocolOp: searchResEntry (4)
            searchResEntry
                objectName: 
                attributes: 5 items
                    PartialAttributeList item dnsHostName
                        type: dnsHostName
                        vals: 1 item
                            AttributeValue: FAKE-DC-AUTH.FAKE.DOMAIN
                    PartialAttributeList item supportedCapabilities
                        type: supportedCapabilities
                        vals: 6 items
                            OID: 1.2.840.113556.1.4.800 (LDAP_CAP_ACTIVE_DIRECTORY_OID)
                            OID: 1.2.840.113556.1.4.1670 (LDAP_CAP_ACTIVE_DIRECTORY_V51_OID)
                            OID: 1.2.840.113556.1.4.1791 (LDAP_CAP_ACTIVE_DIRECTORY_LDAP_INTEG_OID)
                            OID: 1.2.840.113556.1.4.1935 (ISO assigned OIDs, USA.113556.1.4.1935)
                            OID: 1.2.840.113556.1.4.2080 (ISO assigned OIDs, USA.113556.1.4.2080)
                            OID: 1.2.840.113556.1.4.2237 (ISO assigned OIDs, USA.113556.1.4.2237)
                    PartialAttributeList item domainControllerFunctionality
                        type: domainControllerFunctionality
                        vals: 1 item
                            AttributeValue: 6
                    PartialAttributeList item msDS-PortLDAP
                        type: msDS-PortLDAP
                        vals: 1 item
                            AttributeValue: 389
                    PartialAttributeList item msDS-PortSSL
                        type: msDS-PortSSL
                        vals: 1 item
                            AttributeValue: 636
        [Response To: 10]
        [Time: 0.000259900 seconds]
Lightweight Directory Access Protocol
    LDAPMessage searchResDone(78) success [1 result]
        messageID: 78
        protocolOp: searchResDone (5)
            searchResDone
        [Response To: 10]
        [Time: 0.000259900 seconds]

No.     Time                          Source                Destination           Length Protocol Info                                                            New Column
     12 2018-06-11 15:29:46.054333400 10.202.36.35          172.16.22.27          65     LDAP     unbindRequest(79)                                               389

Frame 12: 65 bytes on wire (520 bits), 65 bytes captured (520 bits)
Ethernet II, Src: Cisco_16:c7:43 (44:d3:ca:16:c7:43), Dst: Vmware_ca:ca:9d (00:0c:29:ca:ca:9d)
Internet Protocol Version 4, Src: 10.202.36.35, Dst: 172.16.22.27
Transmission Control Protocol, Src Port: 49984, Dst Port: 389, Seq: 148, Ack: 390, Len: 11
Lightweight Directory Access Protocol
    LDAPMessage unbindRequest(79)
        messageID: 79
        protocolOp: unbindRequest (2)
            unbindRequest

No.     Time                          Source                Destination           Length Protocol Info                                                            New Column
     13 2018-06-11 15:29:46.054333400 10.202.36.35          172.16.22.27          60     TCP      49984 → 389 [FIN, ACK] Seq=159 Ack=390 Win=130816 Len=0       389

Frame 13: 60 bytes on wire (480 bits), 60 bytes captured (480 bits)
Ethernet II, Src: Cisco_16:c7:43 (44:d3:ca:16:c7:43), Dst: Vmware_ca:ca:9d (00:0c:29:ca:ca:9d)
Internet Protocol Version 4, Src: 10.202.36.35, Dst: 172.16.22.27
Transmission Control Protocol, Src Port: 49984, Dst Port: 389, Seq: 159, Ack: 390, Len: 0

No.     Time                          Source                Destination           Length Protocol Info                                                            New Column
     14 2018-06-11 15:29:46.054358400 172.16.22.27          10.202.36.35          54     TCP      389 → 49984 [ACK] Seq=390 Ack=160 Win=65536 Len=0             49984

Frame 14: 54 bytes on wire (432 bits), 54 bytes captured (432 bits)
Ethernet II, Src: Vmware_ca:ca:9d (00:0c:29:ca:ca:9d), Dst: Cisco_16:c7:43 (44:d3:ca:16:c7:43)
Internet Protocol Version 4, Src: 172.16.22.27, Dst: 10.202.36.35
Transmission Control Protocol, Src Port: 389, Dst Port: 49984, Seq: 390, Ack: 160, Len: 0

No.     Time                          Source                Destination           Length Protocol Info                                                            New Column
     15 2018-06-11 15:29:46.054496800 172.16.22.27          10.202.36.35          54     TCP      389 → 49984 [RST, ACK] Seq=390 Ack=160 Win=0 Len=0            49984

Frame 15: 54 bytes on wire (432 bits), 54 bytes captured (432 bits)
Ethernet II, Src: Vmware_ca:ca:9d (00:0c:29:ca:ca:9d), Dst: Cisco_16:c7:43 (44:d3:ca:16:c7:43)
Internet Protocol Version 4, Src: 172.16.22.27, Dst: 10.202.36.35
Transmission Control Protocol, Src Port: 389, Dst Port: 49984, Seq: 390, Ack: 160, Len: 0

**Comment by LYN3S-CO-UK** [comment]
Thanks for such a quick response. I will take a look now. 
FYI, attached is the request and response. 
[ldap.txt](https://github.com/vforteli/Flexinets.Ldap.Server/files/2093855/ldap.txt)

**Comment by LYN3S-CO-UK** [comment]
Thanks for this, I've managed to write the response I was looking for. Much appreciated.

**Comment by vforteli** [comment]
Nice if this project occasionally can be useful :)

**Comment by vforteli** [comment]
This is now fixed in https://github.com/vforteli/Flexinets.Ldap.Core/commit/bf2fd054aaf4c94c0acd3601b0fbc53ce7ce1189
